"Chronic Absenteeism, 2016-17"
"State of Connecticut, Race/Ethnicity"

"Organization","Race/Ethnicity","% Chronically Absent"
"State of Connecticut","American Indian or Alaska Native",12.7
"State of Connecticut","Asian",5.5
"State of Connecticut","Black or African American",14.4
"State of Connecticut","Hispanic/Latino of any race",15.8
"State of Connecticut","Native Hawaiian or Other Pacific Islander",11.0
"State of Connecticut","Two or More Races",9.8
"State of Connecticut","White",6.7

